16:34:57.381873 IP (tos 0x0, ttl 64, id 57030, offset 0, flags [DF], proto TCP (6), length 60)
    192.168.0.110.49232 > 192.168.0.107.8000: Flags [S], cksum 0x74b9 (correct), seq 511328719, win 29200, options [mss 1460,sackOK,TS val 2727689 ecr 0,nop,wscale 7], length 0
16:34:57.464726 IP (tos 0x0, ttl 64, id 0, offset 0, flags [DF], proto TCP (6), length 64)
    192.168.0.107.8000 > 192.168.0.110.49232: Flags [S.], cksum 0x1bc3 (correct), seq 415076660, ack 511328720, win 65535, options [mss 1460,nop,wscale 6,nop,nop,TS val 2308605541 ecr 2727689,sackOK,eol], length 0
16:34:57.464774 IP (tos 0x0, ttl 64, id 57031, offset 0, flags [DF], proto TCP (6), length 52)
    192.168.0.110.49232 > 192.168.0.107.8000: Flags [.], cksum 0x5a9a (correct), seq 1, ack 1, win 229, options [nop,nop,TS val 2727709 ecr 2308605541], length 0
16:34:57.464981 IP (tos 0x0, ttl 64, id 57032, offset 0, flags [DF], proto TCP (6), length 378)
    192.168.0.110.49232 > 192.168.0.107.8000: Flags [P.], cksum 0x3052 (correct), seq 1:327, ack 1, win 229, options [nop,nop,TS val 2727709 ecr 2308605541], length 326
16:34:57.469504 IP (tos 0x0, ttl 64, id 0, offset 0, flags [DF], proto TCP (6), length 52)
    192.168.0.107.8000 > 192.168.0.110.49232: Flags [.], cksum 0x536e (correct), seq 1, ack 1, win 2058, options [nop,nop,TS val 2308605548 ecr 2727709], length 0
16:34:57.469531 IP (tos 0x0, ttl 64, id 0, offset 0, flags [DF], proto TCP (6), length 52)
    192.168.0.107.8000 > 192.168.0.110.49232: Flags [.], cksum 0x522d (correct), seq 1, ack 327, win 2053, options [nop,nop,TS val 2308605548 ecr 2727709], length 0
16:34:57.522153 IP (tos 0x0, ttl 64, id 0, offset 0, flags [DF], proto TCP (6), length 178)
    192.168.0.107.8000 > 192.168.0.110.49232: Flags [P.], cksum 0x977d (correct), seq 1:127, ack 327, win 2053, options [nop,nop,TS val 2308605601 ecr 2727709], length 126
16:34:57.522260 IP (tos 0x0, ttl 64, id 57033, offset 0, flags [DF], proto TCP (6), length 52)
    192.168.0.110.49232 > 192.168.0.107.8000: Flags [.], cksum 0x588b (correct), seq 327, ack 127, win 229, options [nop,nop,TS val 2727724 ecr 2308605601], length 0
16:34:57.528846 IP (tos 0x0, ttl 64, id 0, offset 0, flags [DF], proto TCP (6), length 1500)
    192.168.0.107.8000 > 192.168.0.110.49232: Flags [.], cksum 0x767f (correct), seq 127:1575, ack 327, win 2053, options [nop,nop,TS val 2308605601 ecr 2727709], length 1448
16:34:57.528880 IP (tos 0x0, ttl 64, id 57034, offset 0, flags [DF], proto TCP (6), length 52)
    192.168.0.110.49232 > 192.168.0.107.8000: Flags [.], cksum 0x52cc (correct), seq 327, ack 1575, win 251, options [nop,nop,TS val 2727725 ecr 2308605601], length 0
16:34:57.536393 IP (tos 0x0, ttl 64, id 0, offset 0, flags [DF], proto TCP (6), length 1500)
    192.168.0.107.8000 > 192.168.0.110.49232: Flags [.], cksum 0xcc1b (correct), seq 1575:3023, ack 327, win 2053, options [nop,nop,TS val 2308605601 ecr 2727709], length 1448
16:34:57.536429 IP (tos 0x0, ttl 64, id 57035, offset 0, flags [DF], proto TCP (6), length 52)
    192.168.0.110.49232 > 192.168.0.107.8000: Flags [.], cksum 0x4d0b (correct), seq 327, ack 3023, win 274, options [nop,nop,TS val 2727727 ecr 2308605601], length 0
16:34:57.536446 IP (tos 0x0, ttl 64, id 0, offset 0, flags [DF], proto TCP (6), length 1500)
    192.168.0.107.8000 > 192.168.0.110.49232: Flags [.], cksum 0xddb2 (correct), seq 3023:4471, ack 327, win 2053, options [nop,nop,TS val 2308605601 ecr 2727709], length 1448
16:34:57.536455 IP (tos 0x0, ttl 64, id 57036, offset 0, flags [DF], proto TCP (6), length 52)
    192.168.0.110.49232 > 192.168.0.107.8000: Flags [.], cksum 0x474d (correct), seq 327, ack 4471, win 296, options [nop,nop,TS val 2727727 ecr 2308605601], length 0
16:34:57.536460 IP (tos 0x0, ttl 64, id 0, offset 0, flags [DF], proto TCP (6), length 1500)
    192.168.0.107.8000 > 192.168.0.110.49232: Flags [.], cksum 0x0e8c (correct), seq 4471:5919, ack 327, win 2053, options [nop,nop,TS val 2308605601 ecr 2727709], length 1448
16:34:57.536466 IP (tos 0x0, ttl 64, id 57037, offset 0, flags [DF], proto TCP (6), length 52)
    192.168.0.110.49232 > 192.168.0.107.8000: Flags [.], cksum 0x418e (correct), seq 327, ack 5919, win 319, options [nop,nop,TS val 2727727 ecr 2308605601], length 0
16:34:57.536470 IP (tos 0x0, ttl 64, id 0, offset 0, flags [DF], proto TCP (6), length 1500)
    192.168.0.107.8000 > 192.168.0.110.49232: Flags [.], cksum 0x56a5 (correct), seq 5919:7367, ack 327, win 2053, options [nop,nop,TS val 2308605601 ecr 2727709], length 1448
16:34:57.536476 IP (tos 0x0, ttl 64, id 57038, offset 0, flags [DF], proto TCP (6), length 52)
    192.168.0.110.49232 > 192.168.0.107.8000: Flags [.], cksum 0x3bcf (correct), seq 327, ack 7367, win 342, options [nop,nop,TS val 2727727 ecr 2308605601], length 0
16:34:57.536479 IP (tos 0x0, ttl 64, id 0, offset 0, flags [DF], proto TCP (6), length 1500)
    192.168.0.107.8000 > 192.168.0.110.49232: Flags [.], cksum 0x0825 (correct), seq 7367:8815, ack 327, win 2053, options [nop,nop,TS val 2308605601 ecr 2727709], length 1448
16:34:57.536487 IP (tos 0x0, ttl 64, id 57039, offset 0, flags [DF], proto TCP (6), length 52)
    192.168.0.110.49232 > 192.168.0.107.8000: Flags [.], cksum 0x3611 (correct), seq 327, ack 8815, win 364, options [nop,nop,TS val 2727727 ecr 2308605601], length 0
16:34:57.536490 IP (tos 0x0, ttl 64, id 0, offset 0, flags [DF], proto TCP (6), length 1500)
    192.168.0.107.8000 > 192.168.0.110.49232: Flags [.], cksum 0x9451 (correct), seq 8815:10263, ack 327, win 2053, options [nop,nop,TS val 2308605601 ecr 2727709], length 1448
16:34:57.536496 IP (tos 0x0, ttl 64, id 57040, offset 0, flags [DF], proto TCP (6), length 52)
    192.168.0.110.49232 > 192.168.0.107.8000: Flags [.], cksum 0x3052 (correct), seq 327, ack 10263, win 387, options [nop,nop,TS val 2727727 ecr 2308605601], length 0
16:34:57.550872 IP (tos 0x0, ttl 64, id 0, offset 0, flags [DF], proto TCP (6), length 1500)
    192.168.0.107.8000 > 192.168.0.110.49232: Flags [.], cksum 0xe1ab (correct), seq 10263:11711, ack 327, win 2053, options [nop,nop,TS val 2308605625 ecr 2727724], length 1448
16:34:57.550918 IP (tos 0x0, ttl 64, id 57041, offset 0, flags [DF], proto TCP (6), length 52)
    192.168.0.110.49232 > 192.168.0.107.8000: Flags [.], cksum 0x2a77 (correct), seq 327, ack 11711, win 410, options [nop,nop,TS val 2727731 ecr 2308605625], length 0
16:34:57.550948 IP (tos 0x0, ttl 64, id 0, offset 0, flags [DF], proto TCP (6), length 1500)
    192.168.0.107.8000 > 192.168.0.110.49232: Flags [.], cksum 0xdf92 (correct), seq 11711:13159, ack 327, win 2053, options [nop,nop,TS val 2308605626 ecr 2727725], length 1448
16:34:57.550963 IP (tos 0x0, ttl 64, id 57042, offset 0, flags [DF], proto TCP (6), length 52)
    192.168.0.110.49232 > 192.168.0.107.8000: Flags [.], cksum 0x24b8 (correct), seq 327, ack 13159, win 432, options [nop,nop,TS val 2727731 ecr 2308605626], length 0
16:34:57.550976 IP (tos 0x0, ttl 64, id 0, offset 0, flags [DF], proto TCP (6), length 1500)
    192.168.0.107.8000 > 192.168.0.110.49232: Flags [.], cksum 0x1002 (correct), seq 13159:14607, ack 327, win 2053, options [nop,nop,TS val 2308605626 ecr 2727725], length 1448
16:34:57.550985 IP (tos 0x0, ttl 64, id 57043, offset 0, flags [DF], proto TCP (6), length 52)
    192.168.0.110.49232 > 192.168.0.107.8000: Flags [.], cksum 0x1ef9 (correct), seq 327, ack 14607, win 455, options [nop,nop,TS val 2727731 ecr 2308605626], length 0
16:34:57.550995 IP (tos 0x0, ttl 64, id 0, offset 0, flags [DF], proto TCP (6), length 1500)
    192.168.0.107.8000 > 192.168.0.110.49232: Flags [.], cksum 0xd09e (correct), seq 14607:16055, ack 327, win 2053, options [nop,nop,TS val 2308605626 ecr 2727727], length 1448
16:34:57.551003 IP (tos 0x0, ttl 64, id 57044, offset 0, flags [DF], proto TCP (6), length 52)
    192.168.0.110.49232 > 192.168.0.107.8000: Flags [.], cksum 0x193b (correct), seq 327, ack 16055, win 477, options [nop,nop,TS val 2727731 ecr 2308605626], length 0
16:34:57.551009 IP (tos 0x0, ttl 64, id 0, offset 0, flags [DF], proto TCP (6), length 1500)
    192.168.0.107.8000 > 192.168.0.110.49232: Flags [.], cksum 0x530d (correct), seq 16055:17503, ack 327, win 2053, options [nop,nop,TS val 2308605626 ecr 2727727], length 1448
16:34:57.551016 IP (tos 0x0, ttl 64, id 57045, offset 0, flags [DF], proto TCP (6), length 52)
    192.168.0.110.49232 > 192.168.0.107.8000: Flags [.], cksum 0x137c (correct), seq 327, ack 17503, win 500, options [nop,nop,TS val 2727731 ecr 2308605626], length 0
16:34:57.551022 IP (tos 0x0, ttl 64, id 0, offset 0, flags [DF], proto TCP (6), length 1500)
    192.168.0.107.8000 > 192.168.0.110.49232: Flags [.], cksum 0xd448 (correct), seq 17503:18951, ack 327, win 2053, options [nop,nop,TS val 2308605626 ecr 2727727], length 1448
16:34:57.551030 IP (tos 0x0, ttl 64, id 57046, offset 0, flags [DF], proto TCP (6), length 52)
    192.168.0.110.49232 > 192.168.0.107.8000: Flags [.], cksum 0x0dbd (correct), seq 327, ack 18951, win 523, options [nop,nop,TS val 2727731 ecr 2308605626], length 0
16:34:57.551036 IP (tos 0x0, ttl 64, id 0, offset 0, flags [DF], proto TCP (6), length 1500)
    192.168.0.107.8000 > 192.168.0.110.49232: Flags [.], cksum 0x750e (correct), seq 18951:20399, ack 327, win 2053, options [nop,nop,TS val 2308605626 ecr 2727727], length 1448
16:34:57.551047 IP (tos 0x0, ttl 64, id 57047, offset 0, flags [DF], proto TCP (6), length 52)
    192.168.0.110.49232 > 192.168.0.107.8000: Flags [.], cksum 0x07ff (correct), seq 327, ack 20399, win 545, options [nop,nop,TS val 2727731 ecr 2308605626], length 0
16:34:57.556297 IP (tos 0x0, ttl 64, id 0, offset 0, flags [DF], proto TCP (6), length 1500)
    192.168.0.107.8000 > 192.168.0.110.49232: Flags [.], cksum 0x6c96 (correct), seq 20399:21847, ack 327, win 2053, options [nop,nop,TS val 2308605626 ecr 2727727], length 1448
16:34:57.556344 IP (tos 0x0, ttl 64, id 57048, offset 0, flags [DF], proto TCP (6), length 52)
    192.168.0.110.49232 > 192.168.0.107.8000: Flags [.], cksum 0x023f (correct), seq 327, ack 21847, win 568, options [nop,nop,TS val 2727732 ecr 2308605626], length 0
16:34:57.561771 IP (tos 0x0, ttl 64, id 0, offset 0, flags [DF], proto TCP (6), length 1500)
    192.168.0.107.8000 > 192.168.0.110.49232: Flags [.], cksum 0xbdb9 (correct), seq 21847:23295, ack 327, win 2053, options [nop,nop,TS val 2308605626 ecr 2727727], length 1448
16:34:57.561804 IP (tos 0x0, ttl 64, id 57049, offset 0, flags [DF], proto TCP (6), length 52)
    192.168.0.110.49232 > 192.168.0.107.8000: Flags [.], cksum 0xfc7d (correct), seq 327, ack 23295, win 591, options [nop,nop,TS val 2727734 ecr 2308605626], length 0
16:34:57.568352 IP (tos 0x0, ttl 64, id 0, offset 0, flags [DF], proto TCP (6), length 1500)
    192.168.0.107.8000 > 192.168.0.110.49232: Flags [.], cksum 0x7fff (correct), seq 23295:24743, ack 327, win 2053, options [nop,nop,TS val 2308605630 ecr 2727727], length 1448
16:34:57.568394 IP (tos 0x0, ttl 64, id 57050, offset 0, flags [DF], proto TCP (6), length 52)
    192.168.0.110.49232 > 192.168.0.107.8000: Flags [.], cksum 0xf6ba (correct), seq 327, ack 24743, win 613, options [nop,nop,TS val 2727735 ecr 2308605630], length 0
16:34:57.568421 IP (tos 0x0, ttl 64, id 0, offset 0, flags [DF], proto TCP (6), length 1500)
    192.168.0.107.8000 > 192.168.0.110.49232: Flags [.], cksum 0x9e7c (correct), seq 24743:26191, ack 327, win 2053, options [nop,nop,TS val 2308605630 ecr 2727727], length 1448
16:34:57.568435 IP (tos 0x0, ttl 64, id 57051, offset 0, flags [DF], proto TCP (6), length 52)
    192.168.0.110.49232 > 192.168.0.107.8000: Flags [.], cksum 0xf0fb (correct), seq 327, ack 26191, win 636, options [nop,nop,TS val 2727735 ecr 2308605630], length 0
16:34:57.568444 IP (tos 0x0, ttl 64, id 0, offset 0, flags [DF], proto TCP (6), length 1500)
    192.168.0.107.8000 > 192.168.0.110.49232: Flags [.], cksum 0xde32 (correct), seq 26191:27639, ack 327, win 2053, options [nop,nop,TS val 2308605630 ecr 2727727], length 1448
16:34:57.568451 IP (tos 0x0, ttl 64, id 57052, offset 0, flags [DF], proto TCP (6), length 52)
    192.168.0.110.49232 > 192.168.0.107.8000: Flags [.], cksum 0xeb3d (correct), seq 327, ack 27639, win 658, options [nop,nop,TS val 2727735 ecr 2308605630], length 0
16:34:57.568457 IP (tos 0x0, ttl 64, id 0, offset 0, flags [DF], proto TCP (6), length 1500)
    192.168.0.107.8000 > 192.168.0.110.49232: Flags [.], cksum 0xf13b (correct), seq 27639:29087, ack 327, win 2053, options [nop,nop,TS val 2308605630 ecr 2727727], length 1448
16:34:57.568463 IP (tos 0x0, ttl 64, id 57053, offset 0, flags [DF], proto TCP (6), length 52)
    192.168.0.110.49232 > 192.168.0.107.8000: Flags [.], cksum 0xe57e (correct), seq 327, ack 29087, win 681, options [nop,nop,TS val 2727735 ecr 2308605630], length 0
16:34:57.568468 IP (tos 0x0, ttl 64, id 0, offset 0, flags [DF], proto TCP (6), length 1500)
    192.168.0.107.8000 > 192.168.0.110.49232: Flags [.], cksum 0x5dec (correct), seq 29087:30535, ack 327, win 2053, options [nop,nop,TS val 2308605630 ecr 2727727], length 1448
16:34:57.568473 IP (tos 0x0, ttl 64, id 57054, offset 0, flags [DF], proto TCP (6), length 52)
    192.168.0.110.49232 > 192.168.0.107.8000: Flags [.], cksum 0xdfbf (correct), seq 327, ack 30535, win 704, options [nop,nop,TS val 2727735 ecr 2308605630], length 0
16:34:57.568478 IP (tos 0x0, ttl 64, id 0, offset 0, flags [DF], proto TCP (6), length 812)
    192.168.0.107.8000 > 192.168.0.110.49232: Flags [P.], cksum 0x914d (correct), seq 30535:31295, ack 327, win 2053, options [nop,nop,TS val 2308605630 ecr 2727727], length 760
16:34:57.568484 IP (tos 0x0, ttl 64, id 57055, offset 0, flags [DF], proto TCP (6), length 52)
    192.168.0.110.49232 > 192.168.0.107.8000: Flags [.], cksum 0xdcb1 (correct), seq 327, ack 31295, win 726, options [nop,nop,TS val 2727735 ecr 2308605630], length 0
16:34:57.572798 IP (tos 0x0, ttl 64, id 57056, offset 0, flags [DF], proto TCP (6), length 344)
    192.168.0.110.49232 > 192.168.0.107.8000: Flags [P.], cksum 0xbddb (correct), seq 327:619, ack 31295, win 726, options [nop,nop,TS val 2727736 ecr 2308605630], length 292
16:34:57.573575 IP (tos 0x0, ttl 64, id 19858, offset 0, flags [DF], proto TCP (6), length 60)
    192.168.0.110.49234 > 192.168.0.107.8000: Flags [S], cksum 0x5cee (correct), seq 2771833515, win 29200, options [mss 1460,sackOK,TS val 2727737 ecr 0,nop,wscale 7], length 0
16:34:57.574079 IP (tos 0x0, ttl 64, id 41582, offset 0, flags [DF], proto TCP (6), length 60)
    192.168.0.110.49236 > 192.168.0.107.8000: Flags [S], cksum 0xb4d0 (correct), seq 3802545495, win 29200, options [mss 1460,sackOK,TS val 2727737 ecr 0,nop,wscale 7], length 0
16:34:57.574354 IP (tos 0x0, ttl 64, id 43179, offset 0, flags [DF], proto TCP (6), length 60)
    192.168.0.110.49238 > 192.168.0.107.8000: Flags [S], cksum 0x29a7 (correct), seq 1939027858, win 29200, options [mss 1460,sackOK,TS val 2727737 ecr 0,nop,wscale 7], length 0
16:34:57.580905 IP (tos 0x0, ttl 64, id 28574, offset 0, flags [DF], proto TCP (6), length 60)
    192.168.0.110.49240 > 192.168.0.107.8000: Flags [S], cksum 0x138c (correct), seq 3499684004, win 29200, options [mss 1460,sackOK,TS val 2727738 ecr 0,nop,wscale 7], length 0
16:34:57.607240 IP (tos 0x0, ttl 64, id 0, offset 0, flags [DF], proto TCP (6), length 52)
    192.168.0.107.8000 > 192.168.0.110.49232: Flags [.], cksum 0xd645 (correct), seq 31295, ack 619, win 2049, options [nop,nop,TS val 2308605658 ecr 2727736], length 0
16:34:57.607266 IP (tos 0x0, ttl 64, id 0, offset 0, flags [DF], proto TCP (6), length 64)
    192.168.0.107.8000 > 192.168.0.110.49234: Flags [S.], cksum 0x9176 (correct), seq 2829284186, ack 2771833516, win 65535, options [mss 1460,nop,wscale 6,nop,nop,TS val 2308605658 ecr 2727737,sackOK,eol], length 0
16:34:57.607294 IP (tos 0x0, ttl 64, id 19859, offset 0, flags [DF], proto TCP (6), length 52)
    192.168.0.110.49234 > 192.168.0.107.8000: Flags [.], cksum 0xd059 (correct), seq 1, ack 1, win 229, options [nop,nop,TS val 2727745 ecr 2308605658], length 0
16:34:57.607308 IP (tos 0x0, ttl 64, id 0, offset 0, flags [DF], proto TCP (6), length 64)
    192.168.0.107.8000 > 192.168.0.110.49236: Flags [S.], cksum 0x469f (correct), seq 1319596048, ack 3802545496, win 65535, options [mss 1460,nop,wscale 6,nop,nop,TS val 2308605658 ecr 2727737,sackOK,eol], length 0
16:34:57.607319 IP (tos 0x0, ttl 64, id 41583, offset 0, flags [DF], proto TCP (6), length 52)
    192.168.0.110.49236 > 192.168.0.107.8000: Flags [.], cksum 0x8582 (correct), seq 1, ack 1, win 229, options [nop,nop,TS val 2727745 ecr 2308605658], length 0
16:34:57.607325 IP (tos 0x0, ttl 64, id 0, offset 0, flags [DF], proto TCP (6), length 64)
    192.168.0.107.8000 > 192.168.0.110.49238: Flags [S.], cksum 0x0103 (correct), seq 1629100048, ack 1939027859, win 65535, options [mss 1460,nop,wscale 6,nop,nop,TS val 2308605658 ecr 2727737,sackOK,eol], length 0
16:34:57.607333 IP (tos 0x0, ttl 64, id 43180, offset 0, flags [DF], proto TCP (6), length 52)
    192.168.0.110.49238 > 192.168.0.107.8000: Flags [.], cksum 0x3fe6 (correct), seq 1, ack 1, win 229, options [nop,nop,TS val 2727745 ecr 2308605658], length 0
16:34:57.607338 IP (tos 0x0, ttl 64, id 0, offset 0, flags [DF], proto TCP (6), length 64)
    192.168.0.107.8000 > 192.168.0.110.49240: Flags [S.], cksum 0x9002 (correct), seq 2976916121, ack 3499684005, win 65535, options [mss 1460,nop,wscale 6,nop,nop,TS val 2308605664 ecr 2727738,sackOK,eol], length 0
16:34:57.607346 IP (tos 0x0, ttl 64, id 28575, offset 0, flags [DF], proto TCP (6), length 52)
    192.168.0.110.49240 > 192.168.0.107.8000: Flags [.], cksum 0xcee6 (correct), seq 1, ack 1, win 229, options [nop,nop,TS val 2727745 ecr 2308605664], length 0
16:34:57.607350 IP (tos 0x0, ttl 64, id 0, offset 0, flags [DF], proto TCP (6), length 153)
    192.168.0.107.8000 > 192.168.0.110.49232: Flags [P.], cksum 0xbefa (correct), seq 31295:31396, ack 619, win 2049, options [nop,nop,TS val 2308605664 ecr 2727736], length 101
16:34:57.607357 IP (tos 0x0, ttl 64, id 0, offset 0, flags [DF], proto TCP (6), length 1500)
    192.168.0.107.8000 > 192.168.0.110.49232: Flags [.], cksum 0x608a (correct), seq 31396:32844, ack 619, win 2049, options [nop,nop,TS val 2308605666 ecr 2727736], length 1448
16:34:57.607364 IP (tos 0x0, ttl 64, id 57057, offset 0, flags [DF], proto TCP (6), length 52)
    192.168.0.110.49232 > 192.168.0.107.8000: Flags [.], cksum 0xd53d (correct), seq 619, ack 32844, win 749, options [nop,nop,TS val 2727745 ecr 2308605664], length 0
16:34:57.607369 IP (tos 0x0, ttl 64, id 0, offset 0, flags [DF], proto TCP (6), length 1500)
    192.168.0.107.8000 > 192.168.0.110.49232: Flags [.], cksum 0x220e (correct), seq 32844:34292, ack 619, win 2049, options [nop,nop,TS val 2308605666 ecr 2727736], length 1448
16:34:57.607375 IP (tos 0x0, ttl 64, id 0, offset 0, flags [DF], proto TCP (6), length 1500)
    192.168.0.107.8000 > 192.168.0.110.49232: Flags [.], cksum 0xfd16 (correct), seq 34292:35740, ack 619, win 2049, options [nop,nop,TS val 2308605666 ecr 2727736], length 1448
16:34:57.607381 IP (tos 0x0, ttl 64, id 57058, offset 0, flags [DF], proto TCP (6), length 52)
    192.168.0.110.49232 > 192.168.0.107.8000: Flags [.], cksum 0xc9be (correct), seq 619, ack 35740, win 794, options [nop,nop,TS val 2727745 ecr 2308605666], length 0
16:34:57.607386 IP (tos 0x0, ttl 64, id 0, offset 0, flags [DF], proto TCP (6), length 1500)
    192.168.0.107.8000 > 192.168.0.110.49232: Flags [.], cksum 0x0739 (correct), seq 35740:37188, ack 619, win 2049, options [nop,nop,TS val 2308605666 ecr 2727736], length 1448
16:34:57.607392 IP (tos 0x0, ttl 64, id 0, offset 0, flags [DF], proto TCP (6), length 1500)
    192.168.0.107.8000 > 192.168.0.110.49232: Flags [.], cksum 0x7b6e (correct), seq 37188:38636, ack 619, win 2049, options [nop,nop,TS val 2308605666 ecr 2727736], length 1448
16:34:57.607397 IP (tos 0x0, ttl 64, id 57059, offset 0, flags [DF], proto TCP (6), length 52)
    192.168.0.110.49232 > 192.168.0.107.8000: Flags [.], cksum 0xbe41 (correct), seq 619, ack 38636, win 839, options [nop,nop,TS val 2727745 ecr 2308605666], length 0
16:34:57.607401 IP (tos 0x0, ttl 64, id 0, offset 0, flags [DF], proto TCP (6), length 1500)
    192.168.0.107.8000 > 192.168.0.110.49232: Flags [.], cksum 0xd580 (correct), seq 38636:40084, ack 619, win 2049, options [nop,nop,TS val 2308605666 ecr 2727736], length 1448
16:34:57.607407 IP (tos 0x0, ttl 64, id 0, offset 0, flags [DF], proto TCP (6), length 1500)
    192.168.0.107.8000 > 192.168.0.110.49232: Flags [.], cksum 0x7626 (correct), seq 40084:41532, ack 619, win 2049, options [nop,nop,TS val 2308605666 ecr 2727736], length 1448
16:34:57.607412 IP (tos 0x0, ttl 64, id 57060, offset 0, flags [DF], proto TCP (6), length 52)
    192.168.0.110.49232 > 192.168.0.107.8000: Flags [.], cksum 0xb2c3 (correct), seq 619, ack 41532, win 885, options [nop,nop,TS val 2727745 ecr 2308605666], length 0
16:34:57.607417 IP (tos 0x0, ttl 64, id 0, offset 0, flags [DF], proto TCP (6), length 1500)
    192.168.0.107.8000 > 192.168.0.110.49232: Flags [.], cksum 0xe708 (correct), seq 41532:42980, ack 619, win 2049, options [nop,nop,TS val 2308605666 ecr 2727736], length 1448
16:34:57.607423 IP (tos 0x0, ttl 64, id 0, offset 0, flags [DF], proto TCP (6), length 1500)
    192.168.0.107.8000 > 192.168.0.110.49232: Flags [.], cksum 0x77ce (correct), seq 42980:44428, ack 619, win 2049, options [nop,nop,TS val 2308605666 ecr 2727736], length 1448
16:34:57.607430 IP (tos 0x0, ttl 64, id 57061, offset 0, flags [DF], proto TCP (6), length 52)
    192.168.0.110.49232 > 192.168.0.107.8000: Flags [.], cksum 0xa746 (correct), seq 619, ack 44428, win 930, options [nop,nop,TS val 2727745 ecr 2308605666], length 0
16:34:57.607435 IP (tos 0x0, ttl 64, id 0, offset 0, flags [DF], proto TCP (6), length 1500)
    192.168.0.107.8000 > 192.168.0.110.49232: Flags [.], cksum 0xa64d (correct), seq 44428:45876, ack 619, win 2049, options [nop,nop,TS val 2308605666 ecr 2727736], length 1448
16:34:57.607441 IP (tos 0x0, ttl 64, id 0, offset 0, flags [DF], proto TCP (6), length 1500)
    192.168.0.107.8000 > 192.168.0.110.49232: Flags [.], cksum 0x9824 (correct), seq 45876:47324, ack 619, win 2049, options [nop,nop,TS val 2308605666 ecr 2727736], length 1448
16:34:57.607446 IP (tos 0x0, ttl 64, id 57062, offset 0, flags [DF], proto TCP (6), length 52)
    192.168.0.110.49232 > 192.168.0.107.8000: Flags [.], cksum 0x9bc9 (correct), seq 619, ack 47324, win 975, options [nop,nop,TS val 2727745 ecr 2308605666], length 0
16:34:57.607451 IP (tos 0x0, ttl 64, id 0, offset 0, flags [DF], proto TCP (6), length 1500)
    192.168.0.107.8000 > 192.168.0.110.49232: Flags [.], cksum 0xbc53 (correct), seq 47324:48772, ack 619, win 2049, options [nop,nop,TS val 2308605666 ecr 2727736], length 1448
16:34:57.607456 IP (tos 0x0, ttl 64, id 0, offset 0, flags [DF], proto TCP (6), length 1500)
    192.168.0.107.8000 > 192.168.0.110.49232: Flags [.], cksum 0x1fbb (correct), seq 48772:50220, ack 619, win 2049, options [nop,nop,TS val 2308605666 ecr 2727736], length 1448
16:34:57.607462 IP (tos 0x0, ttl 64, id 57063, offset 0, flags [DF], proto TCP (6), length 52)
    192.168.0.110.49232 > 192.168.0.107.8000: Flags [.], cksum 0x904c (correct), seq 619, ack 50220, win 1020, options [nop,nop,TS val 2727745 ecr 2308605666], length 0
16:34:57.607466 IP (tos 0x0, ttl 64, id 0, offset 0, flags [DF], proto TCP (6), length 1500)
    192.168.0.107.8000 > 192.168.0.110.49232: Flags [.], cksum 0x7749 (correct), seq 50220:51668, ack 619, win 2049, options [nop,nop,TS val 2308605666 ecr 2727736], length 1448
16:34:57.607472 IP (tos 0x0, ttl 64, id 0, offset 0, flags [DF], proto TCP (6), length 1500)
    192.168.0.107.8000 > 192.168.0.110.49232: Flags [.], cksum 0xb651 (correct), seq 51668:53116, ack 619, win 2049, options [nop,nop,TS val 2308605666 ecr 2727736], length 1448
16:34:57.607478 IP (tos 0x0, ttl 64, id 57064, offset 0, flags [DF], proto TCP (6), length 52)
    192.168.0.110.49232 > 192.168.0.107.8000: Flags [.], cksum 0x84ce (correct), seq 619, ack 53116, win 1066, options [nop,nop,TS val 2727745 ecr 2308605666], length 0
16:34:57.607483 IP (tos 0x0, ttl 64, id 0, offset 0, flags [DF], proto TCP (6), length 1500)
    192.168.0.107.8000 > 192.168.0.110.49232: Flags [.], cksum 0x2822 (correct), seq 53116:54564, ack 619, win 2049, options [nop,nop,TS val 2308605666 ecr 2727736], length 1448
16:34:57.607737 IP (tos 0x0, ttl 64, id 19860, offset 0, flags [DF], proto TCP (6), length 345)
    192.168.0.110.49234 > 192.168.0.107.8000: Flags [P.], cksum 0x1b4f (correct), seq 1:294, ack 1, win 229, options [nop,nop,TS val 2727745 ecr 2308605658], length 293
16:34:57.607793 IP (tos 0x0, ttl 64, id 41584, offset 0, flags [DF], proto TCP (6), length 347)
    192.168.0.110.49236 > 192.168.0.107.8000: Flags [P.], cksum 0x0ab8 (correct), seq 1:296, ack 1, win 229, options [nop,nop,TS val 2727745 ecr 2308605658], length 295
16:34:57.607843 IP (tos 0x0, ttl 64, id 43181, offset 0, flags [DF], proto TCP (6), length 349)
    192.168.0.110.49238 > 192.168.0.107.8000: Flags [P.], cksum 0x8cc0 (correct), seq 1:298, ack 1, win 229, options [nop,nop,TS val 2727745 ecr 2308605658], length 297
16:34:57.607888 IP (tos 0x0, ttl 64, id 28576, offset 0, flags [DF], proto TCP (6), length 350)
    192.168.0.110.49240 > 192.168.0.107.8000: Flags [P.], cksum 0x7ae2 (correct), seq 1:299, ack 1, win 229, options [nop,nop,TS val 2727745 ecr 2308605664], length 298
16:34:57.622344 IP (tos 0x0, ttl 64, id 0, offset 0, flags [DF], proto TCP (6), length 52)
    192.168.0.107.8000 > 192.168.0.110.49234: Flags [.], cksum 0xc917 (correct), seq 1, ack 1, win 2058, options [nop,nop,TS val 2308605687 ecr 2727745], length 0
16:34:57.625351 IP (tos 0x0, ttl 64, id 0, offset 0, flags [DF], proto TCP (6), length 52)
    192.168.0.107.8000 > 192.168.0.110.49236: Flags [.], cksum 0x7e35 (correct), seq 1, ack 1, win 2058, options [nop,nop,TS val 2308605698 ecr 2727745], length 0
16:34:57.631452 IP (tos 0x0, ttl 64, id 0, offset 0, flags [DF], proto TCP (6), length 52)
    192.168.0.107.8000 > 192.168.0.110.49238: Flags [.], cksum 0x3899 (correct), seq 1, ack 1, win 2058, options [nop,nop,TS val 2308605698 ecr 2727745], length 0
16:34:57.631480 IP (tos 0x0, ttl 64, id 0, offset 0, flags [DF], proto TCP (6), length 52)
    192.168.0.107.8000 > 192.168.0.110.49240: Flags [.], cksum 0xc79f (correct), seq 1, ack 1, win 2058, options [nop,nop,TS val 2308605698 ecr 2727745], length 0
16:34:57.638398 IP (tos 0x0, ttl 64, id 0, offset 0, flags [DF], proto TCP (6), length 1500)
    192.168.0.107.8000 > 192.168.0.110.49232: Flags [.], cksum 0x6575 (correct), seq 54564:56012, ack 619, win 2049, options [nop,nop,TS val 2308605698 ecr 2727745], length 1448
16:34:57.638430 IP (tos 0x0, ttl 64, id 57065, offset 0, flags [DF], proto TCP (6), length 52)
    192.168.0.110.49232 > 192.168.0.107.8000: Flags [.], cksum 0x7949 (correct), seq 619, ack 56012, win 1111, options [nop,nop,TS val 2727753 ecr 2308605666], length 0
16:34:57.638451 IP (tos 0x0, ttl 64, id 0, offset 0, flags [DF], proto TCP (6), length 1500)
    192.168.0.107.8000 > 192.168.0.110.49232: Flags [.], cksum 0x025d (correct), seq 56012:57460, ack 619, win 2049, options [nop,nop,TS val 2308605698 ecr 2727745], length 1448
16:34:57.638460 IP (tos 0x0, ttl 64, id 0, offset 0, flags [DF], proto TCP (6), length 1500)
    192.168.0.107.8000 > 192.168.0.110.49232: Flags [.], cksum 0x8359 (correct), seq 57460:58908, ack 619, win 2049, options [nop,nop,TS val 2308605698 ecr 2727745], length 1448
16:34:57.638469 IP (tos 0x0, ttl 64, id 57066, offset 0, flags [DF], proto TCP (6), length 52)
    192.168.0.110.49232 > 192.168.0.107.8000: Flags [.], cksum 0x6dac (correct), seq 619, ack 58908, win 1156, options [nop,nop,TS val 2727753 ecr 2308605698], length 0
16:34:57.638478 IP (tos 0x0, ttl 64, id 0, offset 0, flags [DF], proto TCP (6), length 1500)
    192.168.0.107.8000 > 192.168.0.110.49232: Flags [.], cksum 0x119a (correct), seq 58908:60356, ack 619, win 2049, options [nop,nop,TS val 2308605698 ecr 2727745], length 1448
16:34:57.638486 IP (tos 0x0, ttl 64, id 0, offset 0, flags [DF], proto TCP (6), length 1500)
    192.168.0.107.8000 > 192.168.0.110.49232: Flags [.], cksum 0x0e67 (correct), seq 60356:61804, ack 619, win 2049, options [nop,nop,TS val 2308605698 ecr 2727745], length 1448
16:34:57.638492 IP (tos 0x0, ttl 64, id 57067, offset 0, flags [DF], proto TCP (6), length 52)
    192.168.0.110.49232 > 192.168.0.107.8000: Flags [.], cksum 0x622f (correct), seq 619, ack 61804, win 1201, options [nop,nop,TS val 2727753 ecr 2308605698], length 0
16:34:57.638497 IP (tos 0x0, ttl 64, id 0, offset 0, flags [DF], proto TCP (6), length 1500)
    192.168.0.107.8000 > 192.168.0.110.49232: Flags [.], cksum 0x0405 (correct), seq 61804:63252, ack 619, win 2049, options [nop,nop,TS val 2308605698 ecr 2727745], length 1448
16:34:57.638501 IP (tos 0x0, ttl 64, id 0, offset 0, flags [DF], proto TCP (6), length 1500)
    192.168.0.107.8000 > 192.168.0.110.49232: Flags [.], cksum 0x1cf7 (correct), seq 63252:64700, ack 619, win 2049, options [nop,nop,TS val 2308605698 ecr 2727745], length 1448
16:34:57.638506 IP (tos 0x0, ttl 64, id 57068, offset 0, flags [DF], proto TCP (6), length 52)
    192.168.0.110.49232 > 192.168.0.107.8000: Flags [.], cksum 0x56b1 (correct), seq 619, ack 64700, win 1247, options [nop,nop,TS val 2727753 ecr 2308605698], length 0
16:34:57.638510 IP (tos 0x0, ttl 64, id 0, offset 0, flags [DF], proto TCP (6), length 1500)
    192.168.0.107.8000 > 192.168.0.110.49232: Flags [.], cksum 0x603a (correct), seq 64700:66148, ack 619, win 2049, options [nop,nop,TS val 2308605698 ecr 2727745], length 1448
16:34:57.638515 IP (tos 0x0, ttl 64, id 0, offset 0, flags [DF], proto TCP (6), length 1500)
    192.168.0.107.8000 > 192.168.0.110.49232: Flags [.], cksum 0xcddb (correct), seq 66148:67596, ack 619, win 2049, options [nop,nop,TS val 2308605698 ecr 2727745], length 1448
16:34:57.638521 IP (tos 0x0, ttl 64, id 57069, offset 0, flags [DF], proto TCP (6), length 52)
    192.168.0.110.49232 > 192.168.0.107.8000: Flags [.], cksum 0x4b34 (correct), seq 619, ack 67596, win 1292, options [nop,nop,TS val 2727753 ecr 2308605698], length 0
16:34:57.638526 IP (tos 0x0, ttl 64, id 0, offset 0, flags [DF], proto TCP (6), length 1500)
    192.168.0.107.8000 > 192.168.0.110.49232: Flags [.], cksum 0xfd99 (correct), seq 67596:69044, ack 619, win 2049, options [nop,nop,TS val 2308605698 ecr 2727745], length 1448
16:34:57.638532 IP (tos 0x0, ttl 64, id 0, offset 0, flags [DF], proto TCP (6), length 1500)
    192.168.0.107.8000 > 192.168.0.110.49232: Flags [.], cksum 0x1437 (correct), seq 69044:70492, ack 619, win 2049, options [nop,nop,TS val 2308605698 ecr 2727745], length 1448
16:34:57.638539 IP (tos 0x0, ttl 64, id 57070, offset 0, flags [DF], proto TCP (6), length 52)
    192.168.0.110.49232 > 192.168.0.107.8000: Flags [.], cksum 0x3fb7 (correct), seq 619, ack 70492, win 1337, options [nop,nop,TS val 2727753 ecr 2308605698], length 0
16:34:57.638543 IP (tos 0x0, ttl 64, id 0, offset 0, flags [DF], proto TCP (6), length 1500)
    192.168.0.107.8000 > 192.168.0.110.49232: Flags [.], cksum 0x752f (correct), seq 70492:71940, ack 619, win 2049, options [nop,nop,TS val 2308605698 ecr 2727745], length 1448
16:34:57.638548 IP (tos 0x0, ttl 64, id 0, offset 0, flags [DF], proto TCP (6), length 1500)
    192.168.0.107.8000 > 192.168.0.110.49232: Flags [.], cksum 0x457b (correct), seq 71940:73388, ack 619, win 2049, options [nop,nop,TS val 2308605698 ecr 2727745], length 1448
16:34:57.638553 IP (tos 0x0, ttl 64, id 0, offset 0, flags [DF], proto TCP (6), length 1500)
    192.168.0.107.8000 > 192.168.0.110.49232: Flags [.], cksum 0x9ed8 (correct), seq 73388:74836, ack 619, win 2049, options [nop,nop,TS val 2308605698 ecr 2727745], length 1448
16:34:57.638558 IP (tos 0x0, ttl 64, id 0, offset 0, flags [DF], proto TCP (6), length 1500)
    192.168.0.107.8000 > 192.168.0.110.49232: Flags [.], cksum 0xe002 (correct), seq 74836:76284, ack 619, win 2049, options [nop,nop,TS val 2308605698 ecr 2727745], length 1448
16:34:57.638563 IP (tos 0x0, ttl 64, id 0, offset 0, flags [DF], proto TCP (6), length 1500)
    192.168.0.107.8000 > 192.168.0.110.49232: Flags [.], cksum 0x2c1b (correct), seq 76284:77732, ack 619, win 2049, options [nop,nop,TS val 2308605698 ecr 2727745], length 1448
16:34:57.638568 IP (tos 0x0, ttl 64, id 0, offset 0, flags [DF], proto TCP (6), length 1500)
    192.168.0.107.8000 > 192.168.0.110.49232: Flags [.], cksum 0xbcaa (correct), seq 77732:79180, ack 619, win 2049, options [nop,nop,TS val 2308605698 ecr 2727745], length 1448
16:34:57.638575 IP (tos 0x0, ttl 64, id 0, offset 0, flags [DF], proto TCP (6), length 1319)
    192.168.0.107.8000 > 192.168.0.110.49232: Flags [P.], cksum 0xfad4 (correct), seq 79180:80447, ack 619, win 2049, options [nop,nop,TS val 2308605698 ecr 2727745], length 1267
16:34:57.638580 IP (tos 0x0, ttl 64, id 0, offset 0, flags [DF], proto TCP (6), length 1500)
    192.168.0.107.8000 > 192.168.0.110.49232: Flags [.], cksum 0xf4ae (correct), seq 80447:81895, ack 619, win 2049, options [nop,nop,TS val 2308605698 ecr 2727745], length 1448
16:34:57.638586 IP (tos 0x0, ttl 64, id 0, offset 0, flags [DF], proto TCP (6), length 1500)
    192.168.0.107.8000 > 192.168.0.110.49232: Flags [.], cksum 0x2b03 (correct), seq 81895:83343, ack 619, win 2049, options [nop,nop,TS val 2308605698 ecr 2727745], length 1448
16:34:57.638591 IP (tos 0x0, ttl 64, id 0, offset 0, flags [DF], proto TCP (6), length 1500)
    192.168.0.107.8000 > 192.168.0.110.49232: Flags [.], cksum 0x7ab0 (correct), seq 83343:84791, ack 619, win 2049, options [nop,nop,TS val 2308605698 ecr 2727745], length 1448
16:34:57.638596 IP (tos 0x0, ttl 64, id 0, offset 0, flags [DF], proto TCP (6), length 1500)
    192.168.0.107.8000 > 192.168.0.110.49232: Flags [.], cksum 0x972e (correct), seq 84791:86239, ack 619, win 2049, options [nop,nop,TS val 2308605698 ecr 2727745], length 1448
16:34:57.638601 IP (tos 0x0, ttl 64, id 0, offset 0, flags [DF], proto TCP (6), length 1500)
    192.168.0.107.8000 > 192.168.0.110.49232: Flags [.], cksum 0x5e98 (correct), seq 86239:87687, ack 619, win 2049, options [nop,nop,TS val 2308605698 ecr 2727745], length 1448
16:34:57.638606 IP (tos 0x0, ttl 64, id 0, offset 0, flags [DF], proto TCP (6), length 1500)
    192.168.0.107.8000 > 192.168.0.110.49232: Flags [.], cksum 0xd11f (correct), seq 87687:89135, ack 619, win 2049, options [nop,nop,TS val 2308605698 ecr 2727745], length 1448
16:34:57.638611 IP (tos 0x0, ttl 64, id 0, offset 0, flags [DF], proto TCP (6), length 52)
    192.168.0.107.8000 > 192.168.0.110.49234: Flags [.], cksum 0xc7ea (correct), seq 1, ack 294, win 2054, options [nop,nop,TS val 2308605699 ecr 2727745], length 0
16:34:57.638621 IP (tos 0x0, ttl 64, id 0, offset 0, flags [DF], proto TCP (6), length 52)
    192.168.0.107.8000 > 192.168.0.110.49236: Flags [.], cksum 0x7d11 (correct), seq 1, ack 296, win 2054, options [nop,nop,TS val 2308605699 ecr 2727745], length 0
16:34:57.638628 IP (tos 0x0, ttl 64, id 0, offset 0, flags [DF], proto TCP (6), length 52)
    192.168.0.107.8000 > 192.168.0.110.49238: Flags [.], cksum 0x3773 (correct), seq 1, ack 298, win 2054, options [nop,nop,TS val 2308605699 ecr 2727745], length 0
16:34:57.638635 IP (tos 0x0, ttl 64, id 0, offset 0, flags [DF], proto TCP (6), length 52)
    192.168.0.107.8000 > 192.168.0.110.49240: Flags [.], cksum 0xc678 (correct), seq 1, ack 299, win 2054, options [nop,nop,TS val 2308605699 ecr 2727745], length 0
16:34:57.638641 IP (tos 0x0, ttl 64, id 0, offset 0, flags [DF], proto TCP (6), length 153)
    192.168.0.107.8000 > 192.168.0.110.49236: Flags [P.], cksum 0x66cd (correct), seq 1:102, ack 296, win 2054, options [nop,nop,TS val 2308605704 ecr 2727745], length 101
16:34:57.638651 IP (tos 0x0, ttl 64, id 41585, offset 0, flags [DF], proto TCP (6), length 52)
    192.168.0.110.49236 > 192.168.0.107.8000: Flags [.], cksum 0x83c0 (correct), seq 296, ack 102, win 229, options [nop,nop,TS val 2727753 ecr 2308605704], length 0
16:34:57.638661 IP (tos 0x0, ttl 64, id 0, offset 0, flags [DF], proto TCP (6), length 1500)
    192.168.0.107.8000 > 192.168.0.110.49236: Flags [.], cksum 0x059f (correct), seq 102:1550, ack 296, win 2054, options [nop,nop,TS val 2308605704 ecr 2727745], length 1448
16:34:57.638671 IP (tos 0x0, ttl 64, id 41586, offset 0, flags [DF], proto TCP (6), length 52)
    192.168.0.110.49236 > 192.168.0.107.8000: Flags [.], cksum 0x7e02 (correct), seq 296, ack 1550, win 251, options [nop,nop,TS val 2727753 ecr 2308605704], length 0
16:34:57.638679 IP (tos 0x0, ttl 64, id 0, offset 0, flags [DF], proto TCP (6), length 1500)
    192.168.0.107.8000 > 192.168.0.110.49236: Flags [.], cksum 0x976b (correct), seq 1550:2998, ack 296, win 2054, options [nop,nop,TS val 2308605704 ecr 2727745], length 1448
16:34:57.638689 IP (tos 0x0, ttl 64, id 41587, offset 0, flags [DF], proto TCP (6), length 52)
    192.168.0.110.49236 > 192.168.0.107.8000: Flags [.], cksum 0x7843 (correct), seq 296, ack 2998, win 274, options [nop,nop,TS val 2727753 ecr 2308605704], length 0
16:34:57.638696 IP (tos 0x0, ttl 64, id 0, offset 0, flags [DF], proto TCP (6), length 1500)
    192.168.0.107.8000 > 192.168.0.110.49236: Flags [.], cksum 0xf6c3 (correct), seq 2998:4446, ack 296, win 2054, options [nop,nop,TS val 2308605704 ecr 2727745], length 1448
16:34:57.638704 IP (tos 0x0, ttl 64, id 41588, offset 0, flags [DF], proto TCP (6), length 52)
    192.168.0.110.49236 > 192.168.0.107.8000: Flags [.], cksum 0x7285 (correct), seq 296, ack 4446, win 296, options [nop,nop,TS val 2727753 ecr 2308605704], length 0
16:34:57.638711 IP (tos 0x0, ttl 64, id 0, offset 0, flags [DF], proto TCP (6), length 1500)
    192.168.0.107.8000 > 192.168.0.110.49236: Flags [.], cksum 0x3980 (correct), seq 4446:5894, ack 296, win 2054, options [nop,nop,TS val 2308605704 ecr 2727745], length 1448
16:34:57.638719 IP (tos 0x0, ttl 64, id 41589, offset 0, flags [DF], proto TCP (6), length 52)
    192.168.0.110.49236 > 192.168.0.107.8000: Flags [.], cksum 0x6cc6 (correct), seq 296, ack 5894, win 319, options [nop,nop,TS val 2727753 ecr 2308605704], length 0
16:34:57.638726 IP (tos 0x0, ttl 64, id 0, offset 0, flags [DF], proto TCP (6), length 1500)
    192.168.0.107.8000 > 192.168.0.110.49236: Flags [.], cksum 0xbda8 (correct), seq 5894:7342, ack 296, win 2054, options [nop,nop,TS val 2308605704 ecr 2727745], length 1448
16:34:57.638735 IP (tos 0x0, ttl 64, id 41590, offset 0, flags [DF], proto TCP (6), length 52)
    192.168.0.110.49236 > 192.168.0.107.8000: Flags [.], cksum 0x6707 (correct), seq 296, ack 7342, win 342, options [nop,nop,TS val 2727753 ecr 2308605704], length 0
16:34:57.638742 IP (tos 0x0, ttl 64, id 0, offset 0, flags [DF], proto TCP (6), length 1500)
    192.168.0.107.8000 > 192.168.0.110.49236: Flags [.], cksum 0x945e (correct), seq 7342:8790, ack 296, win 2054, options [nop,nop,TS val 2308605704 ecr 2727745], length 1448
16:34:57.638750 IP (tos 0x0, ttl 64, id 41591, offset 0, flags [DF], proto TCP (6), length 52)
    192.168.0.110.49236 > 192.168.0.107.8000: Flags [.], cksum 0x6149 (correct), seq 296, ack 8790, win 364, options [nop,nop,TS val 2727753 ecr 2308605704], length 0
16:34:57.638757 IP (tos 0x0, ttl 64, id 0, offset 0, flags [DF], proto TCP (6), length 1500)
    192.168.0.107.8000 > 192.168.0.110.49236: Flags [.], cksum 0x61a9 (correct), seq 8790:10238, ack 296, win 2054, options [nop,nop,TS val 2308605704 ecr 2727745], length 1448
16:34:57.638766 IP (tos 0x0, ttl 64, id 41592, offset 0, flags [DF], proto TCP (6), length 52)
    192.168.0.110.49236 > 192.168.0.107.8000: Flags [.], cksum 0x5b8a (correct), seq 296, ack 10238, win 387, options [nop,nop,TS val 2727753 ecr 2308605704], length 0
16:34:57.638816 IP (tos 0x0, ttl 64, id 57071, offset 0, flags [DF], proto TCP (6), length 52)
